text_cleaning,slang_removal,tokenization,stemming,stopword_removal,final
segera hubungi call center ihc untuk reservasi informasi jadwal dokter dan infomasi seputar rs ihc telepon whatsapp -- layanan chatbot,segera hubungi panggil tengah ihc untuk reservasi informasi jadwal dokter dan informasi seputar rumah sakit ihc telepon whatsapp -- layanan chatbot,"['segera', 'hubungi', 'panggil', 'tengah', 'ihc', 'untuk', 'reservasi', 'informasi', 'jadwal', 'dokter', 'dan', 'informasi', 'seputar', 'rumah', 'sakit', 'ihc', 'telepon', 'whatsapp', '--', 'layanan', 'chatbot']","['segera', 'hubung', 'panggil', 'tengah', 'ihc', 'untuk', 'reservasi', 'informasi', 'jadwal', 'dokter', 'dan', 'informasi', 'putar', 'rumah', 'sakit', 'ihc', 'telepon', 'whatsapp', '--', 'layan', 'chatbot']","['hubung', 'panggil', 'reservasi', 'informasi', 'jadwal', 'dokter', 'informasi', 'putar', 'rumah', 'sakit', 'telepon', 'whatsapp', '--', 'layan', 'chatbot']",hubung panggil reservasi informasi jadwal dokter informasi putar rumah sakit telepon whatsapp -- layan chatbot
mera coding sath dooor dooor tak koi taluk ni laikin abi pre engineering me tha nimbuz aik app hoti the group chats lye us per nokia keypad walay phone use ker esy bots banata thabhai ap coding sekhaty ho phr student esy hee seekhty ho gy,mera pengkodean sath dooor dooor tak koi taluk ni laikin abi pre engineering saya tha nimbuz oke aplikasi hoti the grup obrolan iya kami per nokia papan tombol walay telepon gunakan ker esy bot banata thabhai apa pengkodean sekhaty ho phr siswa esy hee seekhty ho gaya,"['mera', 'pengkodean', 'sath', 'dooor', 'dooor', 'tak', 'koi', 'taluk', 'ni', 'laikin', 'abi', 'pre', 'engineering', 'saya', 'tha', 'nimbuz', 'oke', 'aplikasi', 'hoti', 'the', 'grup', 'obrolan', 'iya', 'kami', 'per', 'nokia', 'papan', 'tombol', 'walay', 'telepon', 'gunakan', 'ker', 'esy', 'bot', 'banata', 'thabhai', 'apa', 'pengkodean', 'sekhaty', 'ho', 'phr', 'siswa', 'esy', 'hee', 'seekhty', 'ho', 'gaya']","['mera', 'kode', 'sath', 'dooor', 'dooor', 'tak', 'koi', 'taluk', 'ni', 'laikin', 'abi', 'pre', 'engineering', 'saya', 'tha', 'nimbuz', 'oke', 'aplikasi', 'hot', 'the', 'grup', 'obrol', 'iya', 'kami', 'per', 'nokia', 'papan', 'tombol', 'walay', 'telepon', 'guna', 'ker', 'esy', 'bot', 'banata', 'thabhai', 'apa', 'kode', 'sekhaty', 'ho', 'phr', 'siswa', 'esy', 'hee', 'seekhty', 'ho', 'gaya']","['mera', 'kode', 'koi', 'abi', 'pre', 'engineering', 'aplikasi', 'hot', 'grup', 'obrol', 'iya', 'nokia', 'papan', 'tombol', 'telepon', 'bot', 'kode', 'siswa', 'gaya']",mera kode koi abi pre engineering aplikasi hot grup obrol iya nokia papan tombol telepon bot kode siswa gaya
segera hubungi call center ihc untuk reservasi informasi jadwal dokter informasi ihc telemed dan infomasi seputar rs ihc telepon whatsapp -- layanan chatbot,segera hubungi panggil tengah ihc untuk reservasi informasi jadwal dokter informasi ihc telemed dan informasi seputar rumah sakit ihc telepon whatsapp -- layanan chatbot,"['segera', 'hubungi', 'panggil', 'tengah', 'ihc', 'untuk', 'reservasi', 'informasi', 'jadwal', 'dokter', 'informasi', 'ihc', 'telemed', 'dan', 'informasi', 'seputar', 'rumah', 'sakit', 'ihc', 'telepon', 'whatsapp', '--', 'layanan', 'chatbot']","['segera', 'hubung', 'panggil', 'tengah', 'ihc', 'untuk', 'reservasi', 'informasi', 'jadwal', 'dokter', 'informasi', 'ihc', 'telemed', 'dan', 'informasi', 'putar', 'rumah', 'sakit', 'ihc', 'telepon', 'whatsapp', '--', 'layan', 'chatbot']","['hubung', 'panggil', 'reservasi', 'informasi', 'jadwal', 'dokter', 'informasi', 'informasi', 'putar', 'rumah', 'sakit', 'telepon', 'whatsapp', '--', 'layan', 'chatbot']",hubung panggil reservasi informasi jadwal dokter informasi informasi putar rumah sakit telepon whatsapp -- layan chatbot
hey kamu kok cakep kreatif banget pake chatbot,hey kamu kok cakep kreatif banget pakai chatbot,"['hey', 'kamu', 'kok', 'cakep', 'kreatif', 'banget', 'pakai', 'chatbot']","['hey', 'kamu', 'kok', 'cakep', 'kreatif', 'banget', 'pakai', 'chatbot']","['cakep', 'kreatif', 'banget', 'pakai', 'chatbot']",cakep kreatif banget pakai chatbot
jangan lo pake sicepat halu anjing bgtt tai monyet lama bgt paket gue stuck hari chat ke wa pake bot taik bgt dajjal gue butuh paketnya segera anjingg lo tinggal kasih kepastian kalo ilang jg yaudah gue ikhlasin lo malah gak kasih kepastian ah tai anjing,jangan lo pakai sicepat halusinasi anjing banget tai monyet lama banget paket aku terjebak hari chat ke whatsapp pakai bot taik banget dajjal aku butuh paketnya segera anjing lo tinggal kasih kepastian kalau ilang juga iya sudah aku ikhlaskan lo malah tidak kasih kepastian ah tai anjing,"['jangan', 'lo', 'pakai', 'sicepat', 'halusinasi', 'anjing', 'banget', 'tai', 'monyet', 'lama', 'banget', 'paket', 'aku', 'terjebak', 'hari', 'chat', 'ke', 'whatsapp', 'pakai', 'bot', 'taik', 'banget', 'dajjal', 'aku', 'butuh', 'paketnya', 'segera', 'anjing', 'lo', 'tinggal', 'kasih', 'kepastian', 'kalau', 'ilang', 'juga', 'iya', 'sudah', 'aku', 'ikhlaskan', 'lo', 'malah', 'tidak', 'kasih', 'kepastian', 'ah', 'tai', 'anjing']","['jangan', 'lo', 'pakai', 'sicepat', 'halusinasi', 'anjing', 'banget', 'tai', 'monyet', 'lama', 'banget', 'paket', 'aku', 'jebak', 'hari', 'chat', 'ke', 'whatsapp', 'pakai', 'bot', 'taik', 'banget', 'dajjal', 'aku', 'butuh', 'paket', 'segera', 'anjing', 'lo', 'tinggal', 'kasih', 'pasti', 'kalau', 'ilang', 'juga', 'iya', 'sudah', 'aku', 'ikhlas', 'lo', 'malah', 'tidak', 'kasih', 'pasti', 'ah', 'tai', 'anjing']","['pakai', 'sicepat', 'halusinasi', 'anjing', 'banget', 'monyet', 'banget', 'paket', 'jebak', 'chat', 'whatsapp', 'pakai', 'bot', 'banget', 'dajjal', 'butuh', 'paket', 'anjing', 'tinggal', 'kasih', 'ilang', 'iya', 'ikhlas', 'kasih', 'anjing']",pakai sicepat halusinasi anjing banget monyet banget paket jebak chat whatsapp pakai bot banget dajjal butuh paket anjing tinggal kasih ilang iya ikhlas kasih anjing
yaudah chat ke bot tele jualanku,iya sudah chat ke bot telegram jualan ku,"['iya', 'sudah', 'chat', 'ke', 'bot', 'telegram', 'jualan', 'ku']","['iya', 'sudah', 'chat', 'ke', 'bot', 'telegram', 'jual', 'ku']","['iya', 'chat', 'bot', 'telegram', 'jual', 'ku']",iya chat bot telegram jual ku
hai kak maaf sekali ya terkait kendala hifi bisa langsung menghubungi hifi melalui website email contactiohcoid call center tekan no untuk layanan indosat hifi chatbot indira aplikasi my im terima kasihleya,hai kak maaf sekali iya terkait kendala hifi bisa langsung menghubungi hifi melalui website email contactiohcoid panggil tengah tekan tidak untuk layanan indosat hifi chatbot indira aplikasi saya saya terima kasih leya,"['hai', 'kak', 'maaf', 'sekali', 'iya', 'terkait', 'kendala', 'hifi', 'bisa', 'langsung', 'menghubungi', 'hifi', 'melalui', 'website', 'email', 'contactiohcoid', 'panggil', 'tengah', 'tekan', 'tidak', 'untuk', 'layanan', 'indosat', 'hifi', 'chatbot', 'indira', 'aplikasi', 'saya', 'saya', 'terima', 'kasih', 'leya']","['hai', 'kak', 'maaf', 'sekali', 'iya', 'kait', 'kendala', 'hifi', 'bisa', 'langsung', 'hubung', 'hifi', 'lalu', 'website', 'email', 'contactiohcoid', 'panggil', 'tengah', 'tekan', 'tidak', 'untuk', 'layan', 'indosat', 'hifi', 'chatbot', 'indira', 'aplikasi', 'saya', 'saya', 'terima', 'kasih', 'leya']","['kak', 'maaf', 'iya', 'kait', 'kendala', 'langsung', 'hubung', 'website', 'email', 'panggil', 'tekan', 'layan', 'indosat', 'chatbot', 'indira', 'aplikasi', 'terima', 'kasih', 'leya']",kak maaf iya kait kendala langsung hubung website email panggil tekan layan indosat chatbot indira aplikasi terima kasih leya
ganti nama dari bard jadi gemini chatbot google siap bersaing dengan chatgpt,ganti nama dari penyair jadi gemini chatbot google siap bersaing dengan chatgpt,"['ganti', 'nama', 'dari', 'penyair', 'jadi', 'gemini', 'chatbot', 'google', 'siap', 'bersaing', 'dengan', 'chatgpt']","['ganti', 'nama', 'dari', 'sair', 'jadi', 'gemini', 'chatbot', 'google', 'siap', 'saing', 'dengan', 'chatgpt']","['ganti', 'nama', 'sair', 'gemini', 'chatbot', 'google', 'saing', 'chatgpt']",ganti nama sair gemini chatbot google saing chatgpt
enak-enak tidur kebangun sama chat bot kpu bneran dejavu sama notip bbl haechan,enak-enak tidur terbangun sama chat bot komisi pemilihan umum benar dejavu sama notifikasi bbl haechan,"['enak-enak', 'tidur', 'terbangun', 'sama', 'chat', 'bot', 'komisi', 'pemilihan', 'umum', 'benar', 'dejavu', 'sama', 'notifikasi', 'bbl', 'haechan']","['enak', 'tidur', 'bangun', 'sama', 'chat', 'bot', 'komisi', 'pilih', 'umum', 'benar', 'dejavu', 'sama', 'notifikasi', 'bbl', 'haechan']","['enak', 'tidur', 'bangun', 'chat', 'bot', 'komisi', 'pilih', 'dejavu', 'notifikasi']",enak tidur bangun chat bot komisi pilih dejavu notifikasi
google luncurkan gemini chatbot ai pengganti bard,google luncurkan gemini chatbot kecerdasan buatan pengganti penyair,"['google', 'luncurkan', 'gemini', 'chatbot', 'kecerdasan', 'buatan', 'pengganti', 'penyair']","['google', 'luncur', 'gemini', 'chatbot', 'cerdas', 'buat', 'ganti', 'sair']","['google', 'luncur', 'gemini', 'chatbot', 'cerdas', 'ganti', 'sair']",google luncur gemini chatbot cerdas ganti sair
google merilis gemini chatbot ai pengganti bard,google merilis gemini chatbot kecerdasan buatan pengganti penyair,"['google', 'merilis', 'gemini', 'chatbot', 'kecerdasan', 'buatan', 'pengganti', 'penyair']","['google', 'rilis', 'gemini', 'chatbot', 'cerdas', 'buat', 'ganti', 'sair']","['google', 'rilis', 'gemini', 'chatbot', 'cerdas', 'ganti', 'sair']",google rilis gemini chatbot cerdas ganti sair
pemanfaatan chatbot dalam layanan pelanggan dapat meningkatkan efisiensi dan responsivitas di berbagai industri aniespresidenpkspartaiku,pemanfaatan chatbot dalam layanan pelanggan dapat meningkatkan efisiensi dan daya tanggap di berbagai industri anies presiden pks partaiku,"['pemanfaatan', 'chatbot', 'dalam', 'layanan', 'pelanggan', 'dapat', 'meningkatkan', 'efisiensi', 'dan', 'daya', 'tanggap', 'di', 'berbagai', 'industri', 'anies', 'presiden', 'pks', 'partaiku']","['manfaat', 'chatbot', 'dalam', 'layan', 'langgan', 'dapat', 'tingkat', 'efisiensi', 'dan', 'daya', 'tanggap', 'di', 'bagai', 'industri', 'anies', 'presiden', 'pks', 'partai']","['manfaat', 'chatbot', 'layan', 'langgan', 'tingkat', 'efisiensi', 'daya', 'tanggap', 'industri', 'anies', 'presiden', 'pks', 'partai']",manfaat chatbot layan langgan tingkat efisiensi daya tanggap industri anies presiden pks partai
capek bgt chat komplain ke jnt bot mulu yg jawab bikin emosi,capek banget chat komplain ke jnt bot mulu yang jawab bikin emosi,"['capek', 'banget', 'chat', 'komplain', 'ke', 'jnt', 'bot', 'mulu', 'yang', 'jawab', 'bikin', 'emosi']","['capek', 'banget', 'chat', 'komplain', 'ke', 'jnt', 'bot', 'mulu', 'yang', 'jawab', 'bikin', 'emosi']","['capek', 'banget', 'chat', 'komplain', 'jnt', 'bot', 'bikin', 'emosi']",capek banget chat komplain jnt bot bikin emosi
takutnya yg tadi di chat kamu itu bot doang alias cs nya yg manusia gatau entah kemana,takutnya yang tadi di chat kamu itu bot hanya alias customer service nya yang manusia tidak tahu entah kemana,"['takutnya', 'yang', 'tadi', 'di', 'chat', 'kamu', 'itu', 'bot', 'hanya', 'alias', 'customer', 'service', 'nya', 'yang', 'manusia', 'tidak', 'tahu', 'entah', 'kemana']","['takut', 'yang', 'tadi', 'di', 'chat', 'kamu', 'itu', 'bot', 'hanya', 'alias', 'customer', 'service', 'nya', 'yang', 'manusia', 'tidak', 'tahu', 'entah', 'mana']","['takut', 'chat', 'bot', 'alias', 'customer', 'service', 'manusia']",takut chat bot alias customer service manusia
temen chat cowok cmn bot,teman chat cowok cuman bot,"['teman', 'chat', 'cowok', 'cuman', 'bot']","['teman', 'chat', 'cowok', 'cuman', 'bot']","['teman', 'chat', 'cowok', 'cuman', 'bot']",teman chat cowok cuman bot
chatbot tanya jawab program unggulan ganjar mahfud demo video,chatbot tanya jawab program unggulan ganjar mahfud demo video,"['chatbot', 'tanya', 'jawab', 'program', 'unggulan', 'ganjar', 'mahfud', 'demo', 'video']","['chatbot', 'tanya', 'jawab', 'program', 'unggul', 'ganjar', 'mahfud', 'demo', 'video']","['chatbot', 'program', 'unggul', 'ganjar', 'mahfud', 'demo', 'video']",chatbot program unggul ganjar mahfud demo video
bukan lagi bard chatbot ai google resmi ganti nama jadi gemini,bukan lagi penyair chatbot kecerdasan buatan google resmi ganti nama jadi gemini,"['bukan', 'lagi', 'penyair', 'chatbot', 'kecerdasan', 'buatan', 'google', 'resmi', 'ganti', 'nama', 'jadi', 'gemini']","['bukan', 'lagi', 'sair', 'chatbot', 'cerdas', 'buat', 'google', 'resmi', 'ganti', 'nama', 'jadi', 'gemini']","['sair', 'chatbot', 'cerdas', 'google', 'resmi', 'ganti', 'nama', 'gemini']",sair chatbot cerdas google resmi ganti nama gemini
wordpress bunuh dreamweaver coders no-code bunuh wordpress robotics bunuh blue collar jobs ai bunuh creative talents professionals akan dibunuh agi medical checkup report pon boleh upload dalam chatgpt dia explain lagi better dari bayar doktor klinik blood test,wordpress bunuh dreamweaver pembuat kode no-code bunuh wordpress robotika bunuh biru kerah pekerjaan kecerdasan buatan bunuh kreatif bakat profesional akan dibunuh lagi medis pemeriksaan laporan pon boleh upload dalam chatgpt dia jelaskan lagi lebih baik dari bayar doktor klinik darah uji,"['wordpress', 'bunuh', 'dreamweaver', 'pembuat', 'kode', 'no-code', 'bunuh', 'wordpress', 'robotika', 'bunuh', 'biru', 'kerah', 'pekerjaan', 'kecerdasan', 'buatan', 'bunuh', 'kreatif', 'bakat', 'profesional', 'akan', 'dibunuh', 'lagi', 'medis', 'pemeriksaan', 'laporan', 'pon', 'boleh', 'upload', 'dalam', 'chatgpt', 'dia', 'jelaskan', 'lagi', 'lebih', 'baik', 'dari', 'bayar', 'doktor', 'klinik', 'darah', 'uji']","['wordpress', 'bunuh', 'dreamweaver', 'buat', 'kode', 'no-code', 'bunuh', 'wordpress', 'robotika', 'bunuh', 'biru', 'kerah', 'kerja', 'cerdas', 'buat', 'bunuh', 'kreatif', 'bakat', 'profesional', 'akan', 'bunuh', 'lagi', 'medis', 'periksa', 'lapor', 'pon', 'boleh', 'upload', 'dalam', 'chatgpt', 'dia', 'jelas', 'lagi', 'lebih', 'baik', 'dari', 'bayar', 'doktor', 'klinik', 'darah', 'uji']","['wordpress', 'bunuh', 'dreamweaver', 'kode', 'no-code', 'bunuh', 'wordpress', 'robotika', 'bunuh', 'biru', 'kerah', 'kerja', 'cerdas', 'bunuh', 'kreatif', 'bakat', 'profesional', 'bunuh', 'medis', 'periksa', 'lapor', 'pon', 'upload', 'chatgpt', 'bayar', 'doktor', 'klinik', 'darah', 'uji']",wordpress bunuh dreamweaver kode no-code bunuh wordpress robotika bunuh biru kerah kerja cerdas bunuh kreatif bakat profesional bunuh medis periksa lapor pon upload chatgpt bayar doktor klinik darah uji
rand banget tanya ginian ke chat gpt gara tdi malem kucingku pas tidur dia nglindur ngeong gtu tpi dia tidur,acak banget tanya beginian ke chat gpt gara tadi malam kucingku pas tidur dia mengigau ngeong begitu tapi dia tidur,"['acak', 'banget', 'tanya', 'beginian', 'ke', 'chat', 'gpt', 'gara', 'tadi', 'malam', 'kucingku', 'pas', 'tidur', 'dia', 'mengigau', 'ngeong', 'begitu', 'tapi', 'dia', 'tidur']","['acak', 'banget', 'tanya', 'begini', 'ke', 'chat', 'gpt', 'gara', 'tadi', 'malam', 'kucing', 'pas', 'tidur', 'dia', 'igau', 'ngeong', 'begitu', 'tapi', 'dia', 'tidur']","['acak', 'banget', 'chat', 'gpt', 'gara', 'malam', 'kucing', 'pas', 'tidur', 'igau', 'tidur']",acak banget chat gpt gara malam kucing pas tidur igau tidur
yg jual chatgpt tawarin ya,yang jual chatgpt tawarkan iya,"['yang', 'jual', 'chatgpt', 'tawarkan', 'iya']","['yang', 'jual', 'chatgpt', 'tawar', 'iya']","['jual', 'chatgpt', 'tawar', 'iya']",jual chatgpt tawar iya
nah ini kami tarot reader selalu butuh contextbackground info yg detail supaya bisa ngasih hasil yg detail juga ke client betul kayak chatgpt tingkat resonate atau tidaknya jg bergantung dr berapa banyak keyword yang kalian kasih ke kami cr tiktok,nah ini kami tarot pembaca selalu butuh latar belakang konteks info yang detail supaya bisa memberi hasil yang detail juga ke klien betul kayak chatgpt tingkat beresonasi atau tidaknya juga bergantung dari berapa banyak kata kunci yang kalian kasih ke kami cara tiktok,"['nah', 'ini', 'kami', 'tarot', 'pembaca', 'selalu', 'butuh', 'latar', 'belakang', 'konteks', 'info', 'yang', 'detail', 'supaya', 'bisa', 'memberi', 'hasil', 'yang', 'detail', 'juga', 'ke', 'klien', 'betul', 'kayak', 'chatgpt', 'tingkat', 'beresonasi', 'atau', 'tidaknya', 'juga', 'bergantung', 'dari', 'berapa', 'banyak', 'kata', 'kunci', 'yang', 'kalian', 'kasih', 'ke', 'kami', 'cara', 'tiktok']","['nah', 'ini', 'kami', 'tarot', 'baca', 'selalu', 'butuh', 'latar', 'belakang', 'konteks', 'info', 'yang', 'detail', 'supaya', 'bisa', 'beri', 'hasil', 'yang', 'detail', 'juga', 'ke', 'klien', 'betul', 'kayak', 'chatgpt', 'tingkat', 'beresonasi', 'atau', 'tidak', 'juga', 'gantung', 'dari', 'berapa', 'banyak', 'kata', 'kunci', 'yang', 'kalian', 'kasih', 'ke', 'kami', 'cara', 'tiktok']","['tarot', 'baca', 'butuh', 'latar', 'konteks', 'info', 'detail', 'hasil', 'detail', 'klien', 'kayak', 'chatgpt', 'tingkat', 'beresonasi', 'gantung', 'kunci', 'kasih', 'tiktok']",tarot baca butuh latar konteks info detail hasil detail klien kayak chatgpt tingkat beresonasi gantung kunci kasih tiktok
isteri bersihkan kabinet dapur dengan campuran air suam cuka dan sabun basuh pinggan bersih betul dan memang berkesan mana isteri belajar mengenai campuran ini chatgpt,misteri bersihkan kabinet dapur dengan campuran air suam cuka dan sabun basuh pinggan bersih betul dan memang berkesan mana misteri belajar mengenai campuran ini chatgpt,"['misteri', 'bersihkan', 'kabinet', 'dapur', 'dengan', 'campuran', 'air', 'suam', 'cuka', 'dan', 'sabun', 'basuh', 'pinggan', 'bersih', 'betul', 'dan', 'memang', 'berkesan', 'mana', 'misteri', 'belajar', 'mengenai', 'campuran', 'ini', 'chatgpt']","['misteri', 'sih', 'kabinet', 'dapur', 'dengan', 'campur', 'air', 'suam', 'cuka', 'dan', 'sabun', 'basuh', 'pinggan', 'bersih', 'betul', 'dan', 'memang', 'kesan', 'mana', 'misteri', 'ajar', 'kena', 'campur', 'ini', 'chatgpt']","['misteri', 'kabinet', 'dapur', 'campur', 'air', 'suam', 'cuka', 'sabun', 'basuh', 'pinggan', 'bersih', 'kesan', 'misteri', 'ajar', 'kena', 'campur', 'chatgpt']",misteri kabinet dapur campur air suam cuka sabun basuh pinggan bersih kesan misteri ajar kena campur chatgpt
need chatgpt sekarang,butuh chatgpt sekarang,"['butuh', 'chatgpt', 'sekarang']","['butuh', 'chatgpt', 'sekarang']","['butuh', 'chatgpt']",butuh chatgpt
chatgpt sharing itu kayak gimana sih kalau bisa pakai akun sendiri mau dong,chatgpt berbagi itu kayak bagaimana sih kalau bisa pakai akun sendiri mau dong,"['chatgpt', 'berbagi', 'itu', 'kayak', 'bagaimana', 'sih', 'kalau', 'bisa', 'pakai', 'akun', 'sendiri', 'mau', 'dong']","['chatgpt', 'bagi', 'itu', 'kayak', 'bagaimana', 'sih', 'kalau', 'bisa', 'pakai', 'akun', 'sendiri', 'mau', 'dong']","['chatgpt', 'kayak', 'pakai', 'akun']",chatgpt kayak pakai akun
info yang jual chatgpt dong,info yang jual chatgpt dong,"['info', 'yang', 'jual', 'chatgpt', 'dong']","['info', 'yang', 'jual', 'chatgpt', 'dong']","['info', 'jual', 'chatgpt']",info jual chatgpt
rekomendasi belajar tentang ai ai essentials chatgpt mastery google ai magic harvard ai introduction microsoft ai basics -,rekomendasi belajar tentang kecerdasan buatan kecerdasan buatan penting chatgpt misteri google kecerdasan buatan sihir harvard kecerdasan buatan pengenalan microsoft kecerdasan buatan dasar-dasar -,"['rekomendasi', 'belajar', 'tentang', 'kecerdasan', 'buatan', 'kecerdasan', 'buatan', 'penting', 'chatgpt', 'misteri', 'google', 'kecerdasan', 'buatan', 'sihir', 'harvard', 'kecerdasan', 'buatan', 'pengenalan', 'microsoft', 'kecerdasan', 'buatan', 'dasar-dasar', '-']","['rekomendasi', 'ajar', 'tentang', 'cerdas', 'buat', 'cerdas', 'buat', 'penting', 'chatgpt', 'misteri', 'google', 'cerdas', 'buat', 'sihir', 'harvard', 'cerdas', 'buat', 'kenal', 'microsoft', 'cerdas', 'buat', 'dasar', '-']","['rekomendasi', 'ajar', 'cerdas', 'cerdas', 'chatgpt', 'misteri', 'google', 'cerdas', 'sihir', 'harvard', 'cerdas', 'kenal', 'microsoft', 'cerdas', 'dasar', '-']",rekomendasi ajar cerdas cerdas chatgpt misteri google cerdas sihir harvard cerdas kenal microsoft cerdas dasar -
pacarku nanya pake ai ya wkwk kedetect ai nih setelah aku kirim surat sepanjang halaman dia bilang cek di website deteksi ai gitu dan chatgpt katanya suratku aku bingung responnya gimana padahal aku anak sastra inggris semester akhir ini cont,pacarku tanya pakai kecerdasan buatan iya wkwk terlacak kecerdasan buatan nih setelah aku kirim surat sepanjang halaman dia bilang cek di website deteksi kecerdasan buatan begitu dan chatgpt katanya suratku aku bingung responsnya bagaimana padahal aku anak sastra inggris semester akhir ini cont,"['pacarku', 'tanya', 'pakai', 'kecerdasan', 'buatan', 'iya', 'wkwk', 'terlacak', 'kecerdasan', 'buatan', 'nih', 'setelah', 'aku', 'kirim', 'surat', 'sepanjang', 'halaman', 'dia', 'bilang', 'cek', 'di', 'website', 'deteksi', 'kecerdasan', 'buatan', 'begitu', 'dan', 'chatgpt', 'katanya', 'suratku', 'aku', 'bingung', 'responsnya', 'bagaimana', 'padahal', 'aku', 'anak', 'sastra', 'inggris', 'semester', 'akhir', 'ini', 'cont']","['pacar', 'tanya', 'pakai', 'cerdas', 'buat', 'iya', 'wkwk', 'lacak', 'cerdas', 'buat', 'nih', 'telah', 'aku', 'kirim', 'surat', 'panjang', 'halaman', 'dia', 'bilang', 'cek', 'di', 'website', 'deteksi', 'cerdas', 'buat', 'begitu', 'dan', 'chatgpt', 'kata', 'surat', 'aku', 'bingung', 'respons', 'bagaimana', 'padahal', 'aku', 'anak', 'sastra', 'inggris', 'semester', 'akhir', 'ini', 'cont']","['pacar', 'pakai', 'cerdas', 'iya', 'lacak', 'cerdas', 'kirim', 'surat', 'halaman', 'bilang', 'cek', 'website', 'deteksi', 'cerdas', 'chatgpt', 'surat', 'bingung', 'respons', 'anak', 'sastra', 'inggris', 'semester']",pacar pakai cerdas iya lacak cerdas kirim surat halaman bilang cek website deteksi cerdas chatgpt surat bingung respons anak sastra inggris semester
look at this fafifu wasweswos our tax money berubah jd beginian btw tahun lalu sekitar okt ini dokumen sempet rame juga karna ada beberapa bahasan yg katanya ditulis by chatgpt,lihat pada ini fafifu wasweswos kami pajak money berubah jadi begini ngomong-ngomong tahun lalu sekitar okt ini dokumen sempat ramai juga karena ada beberapa bahasan yang katanya ditulis oleh chatgpt,"['lihat', 'pada', 'ini', 'fafifu', 'wasweswos', 'kami', 'pajak', 'money', 'berubah', 'jadi', 'begini', 'ngomong-ngomong', 'tahun', 'lalu', 'sekitar', 'okt', 'ini', 'dokumen', 'sempat', 'ramai', 'juga', 'karena', 'ada', 'beberapa', 'bahasan', 'yang', 'katanya', 'ditulis', 'oleh', 'chatgpt']","['lihat', 'pada', 'ini', 'fafifu', 'wasweswos', 'kami', 'pajak', 'money', 'ubah', 'jadi', 'begini', 'ngomong-ngomong', 'tahun', 'lalu', 'sekitar', 'okt', 'ini', 'dokumen', 'sempat', 'ramai', 'juga', 'karena', 'ada', 'beberapa', 'bahas', 'yang', 'kata', 'tulis', 'oleh', 'chatgpt']","['lihat', 'pajak', 'money', 'ubah', 'ngomong-ngomong', 'dokumen', 'ramai', 'bahas', 'tulis', 'chatgpt']",lihat pajak money ubah ngomong-ngomong dokumen ramai bahas tulis chatgpt
minimal tanya chatgpt,minimal tanya chatgpt,"['minimal', 'tanya', 'chatgpt']","['minimal', 'tanya', 'chatgpt']","['minimal', 'chatgpt']",minimal chatgpt
gue sering konseling online by chat kalo pun dikasih saran yang cenderung umum ketika kita follow up tuh pasti ada kejelasan lebih lanjut ini template udh kek chatgpt buset temen gue bayar anjir buat konseling,aku sering konseling online oleh chat kalau pun diberi saran yang cenderung umum ketika kita ikuti naik tuh pasti ada kejelasan lebih lanjut ini template sudah seperti chatgpt buset teman aku bayar anjir buat konseling,"['aku', 'sering', 'konseling', 'online', 'oleh', 'chat', 'kalau', 'pun', 'diberi', 'saran', 'yang', 'cenderung', 'umum', 'ketika', 'kita', 'ikuti', 'naik', 'tuh', 'pasti', 'ada', 'kejelasan', 'lebih', 'lanjut', 'ini', 'template', 'sudah', 'seperti', 'chatgpt', 'buset', 'teman', 'aku', 'bayar', 'anjir', 'buat', 'konseling']","['aku', 'sering', 'konseling', 'online', 'oleh', 'chat', 'kalau', 'pun', 'beri', 'saran', 'yang', 'cenderung', 'umum', 'ketika', 'kita', 'ikut', 'naik', 'tuh', 'pasti', 'ada', 'jelas', 'lebih', 'lanjut', 'ini', 'template', 'sudah', 'seperti', 'chatgpt', 'buset', 'teman', 'aku', 'bayar', 'anjir', 'buat', 'konseling']","['konseling', 'online', 'chat', 'saran', 'cenderung', 'template', 'chatgpt', 'teman', 'bayar', 'anjir', 'konseling']",konseling online chat saran cenderung template chatgpt teman bayar anjir konseling
mr unul nilai essay pake ai yaudah akan gue garap dgn chatgpt balance,tuan unul nilai essay pakai kecerdasan buatan iya sudah akan aku kerja dengan chatgpt keseimbangan,"['tuan', 'unul', 'nilai', 'essay', 'pakai', 'kecerdasan', 'buatan', 'iya', 'sudah', 'akan', 'aku', 'kerja', 'dengan', 'chatgpt', 'keseimbangan']","['tuan', 'unul', 'nilai', 'essay', 'pakai', 'cerdas', 'buat', 'iya', 'sudah', 'akan', 'aku', 'kerja', 'dengan', 'chatgpt', 'imbang']","['tuan', 'nilai', 'essay', 'pakai', 'cerdas', 'iya', 'kerja', 'chatgpt', 'imbang']",tuan nilai essay pakai cerdas iya kerja chatgpt imbang
wtb chat gpt plus hari yg bisa sekarang,want to buy chat gpt ditambah hari yang bisa sekarang,"['want', 'to', 'buy', 'chat', 'gpt', 'ditambah', 'hari', 'yang', 'bisa', 'sekarang']","['want', 'to', 'buy', 'chat', 'gpt', 'tambah', 'hari', 'yang', 'bisa', 'sekarang']","['want', 'to', 'buy', 'chat', 'gpt']",want to buy chat gpt
kakkk ada chatgpt yg propremium ga hehehehe,kak ada chatgpt yang pro premium tidak hehehehe,"['kak', 'ada', 'chatgpt', 'yang', 'pro', 'premium', 'tidak', 'hehehehe']","['kak', 'ada', 'chatgpt', 'yang', 'pro', 'premium', 'tidak', 'hehehehe']","['kak', 'chatgpt', 'pro', 'premium']",kak chatgpt pro premium
mau beli chat gpt,mau beli chat gpt,"['mau', 'beli', 'chat', 'gpt']","['mau', 'beli', 'chat', 'gpt']","['beli', 'chat', 'gpt']",beli chat gpt
