text_cleaning,slang_removal,tokenization,stemming,stopword_removal,final
ready nih kak akun chatgpt sharing kbulan bisa akses gpt testimoni bisa cek pinned yahh fast response,siap nih kak akun chatgpt berbagi ke bulan bisa akses gpt testimoni bisa cek disematkan yahh cepat respons,"['siap', 'nih', 'kak', 'akun', 'chatgpt', 'berbagi', 'ke', 'bulan', 'bisa', 'akses', 'gpt', 'testimoni', 'bisa', 'cek', 'disematkan', 'yahh', 'cepat', 'respons']","['siap', 'nih', 'kak', 'akun', 'chatgpt', 'bagi', 'ke', 'bulan', 'bisa', 'akses', 'gpt', 'testimoni', 'bisa', 'cek', 'semat', 'yahh', 'cepat', 'respons']","['kak', 'akun', 'chatgpt', 'akses', 'gpt', 'testimoni', 'cek', 'semat', 'cepat', 'respons']",kak akun chatgpt akses gpt testimoni cek semat cepat respons
halo aku open jasa joki tugas khusus pkn pancasila dan kewarganegaraan ya membantu makalah essayartikel bertema soal essaypilgan analisa kasusfilm ppt dll pengerjaan manual full parafrase tanpa aichat gpt,halo aku buka jasa joki tugas khusus pekan pancasila dan kewarganegaraan iya membantu makalah essay artikel bertema soal essay pilgan analisis kasus film ppt dan lain-lain pengerjaan manual penuh parafrasa tanpa chatbot kecerdasan buatan gpt,"['halo', 'aku', 'buka', 'jasa', 'joki', 'tugas', 'khusus', 'pekan', 'pancasila', 'dan', 'kewarganegaraan', 'iya', 'membantu', 'makalah', 'essay', 'artikel', 'bertema', 'soal', 'essay', 'pilgan', 'analisis', 'kasus', 'film', 'ppt', 'dan', 'lain-lain', 'pengerjaan', 'manual', 'penuh', 'parafrasa', 'tanpa', 'chatbot', 'kecerdasan', 'buatan', 'gpt']","['halo', 'aku', 'buka', 'jasa', 'joki', 'tugas', 'khusus', 'pekan', 'pancasila', 'dan', 'kewarganegaraan', 'iya', 'bantu', 'makalah', 'essay', 'artikel', 'tema', 'soal', 'essay', 'pilgan', 'analisis', 'kasus', 'film', 'ppt', 'dan', 'lain', 'kerja', 'manual', 'penuh', 'parafrasa', 'tanpa', 'chatbot', 'cerdas', 'buat', 'gpt']","['halo', 'buka', 'jasa', 'joki', 'tugas', 'khusus', 'pekan', 'pancasila', 'kewarganegaraan', 'iya', 'bantu', 'makalah', 'essay', 'artikel', 'tema', 'essay', 'pilgan', 'analisis', 'film', 'ppt', 'kerja', 'manual', 'penuh', 'parafrasa', 'chatbot', 'cerdas', 'gpt']",halo buka jasa joki tugas khusus pekan pancasila kewarganegaraan iya bantu makalah essay artikel tema essay pilgan analisis film ppt kerja manual penuh parafrasa chatbot cerdas gpt
hallo aku masih open joki tugas pkn pancasila amp,halo aku masih buka joki tugas pekan pancasila amp,"['halo', 'aku', 'masih', 'buka', 'joki', 'tugas', 'pekan', 'pancasila', 'amp']","['halo', 'aku', 'masih', 'buka', 'joki', 'tugas', 'pekan', 'pancasila', 'amp']","['halo', 'buka', 'joki', 'tugas', 'pekan', 'pancasila']",halo buka joki tugas pekan pancasila
halo aku juga bisa membuat essayartikel bertema ya sudah termasuk parafrase argumentasi opini dan jaminan bebas plagiasi dengan turnitin pastinya dikerjakan secara manual tanpa aichat gpt testi,halo aku juga bisa membuat essay artikel bertema iya sudah termasuk parafrasa argumentasi opini dan jaminan bebas plagiasi dengan turnitin pastinya dikerjakan secara manual tanpa chatbot kecerdasan buatan gpt testimoni,"['halo', 'aku', 'juga', 'bisa', 'membuat', 'essay', 'artikel', 'bertema', 'iya', 'sudah', 'termasuk', 'parafrasa', 'argumentasi', 'opini', 'dan', 'jaminan', 'bebas', 'plagiasi', 'dengan', 'turnitin', 'pastinya', 'dikerjakan', 'secara', 'manual', 'tanpa', 'chatbot', 'kecerdasan', 'buatan', 'gpt', 'testimoni']","['halo', 'aku', 'juga', 'bisa', 'buat', 'essay', 'artikel', 'tema', 'iya', 'sudah', 'masuk', 'parafrasa', 'argumentasi', 'opini', 'dan', 'jamin', 'bebas', 'plagiasi', 'dengan', 'turnitin', 'pasti', 'kerja', 'cara', 'manual', 'tanpa', 'chatbot', 'cerdas', 'buat', 'gpt', 'testimoni']","['halo', 'essay', 'artikel', 'tema', 'iya', 'masuk', 'parafrasa', 'argumentasi', 'opini', 'jamin', 'bebas', 'plagiasi', 'turnitin', 'kerja', 'manual', 'chatbot', 'cerdas', 'gpt', 'testimoni']",halo essay artikel tema iya masuk parafrasa argumentasi opini jamin bebas plagiasi turnitin kerja manual chatbot cerdas gpt testimoni
kaya chat sama gpt,kaya chat sama gpt,"['kaya', 'chat', 'sama', 'gpt']","['kaya', 'chat', 'sama', 'gpt']","['kaya', 'chat', 'gpt']",kaya chat gpt
ini zayne udah kayak chat gpt anjinrt,ini zayne sudah kayak chat gpt anjing,"['ini', 'zayne', 'sudah', 'kayak', 'chat', 'gpt', 'anjing']","['ini', 'zayne', 'sudah', 'kayak', 'chat', 'gpt', 'anjing']","['zayne', 'kayak', 'chat', 'gpt', 'anjing']",zayne kayak chat gpt anjing
linux command gpt sekarang bisa baca file case yang sering kepake nge-format file json sama filter file json bisa buat mac juga ya install jq biar bisa mainin file json,linux perintah gpt sekarang bisa baca file kasus yang sering terpakai memformat file json sama saring file json bisa buat mac juga iya install jq biar bisa mainkan file json,"['linux', 'perintah', 'gpt', 'sekarang', 'bisa', 'baca', 'file', 'kasus', 'yang', 'sering', 'terpakai', 'memformat', 'file', 'json', 'sama', 'saring', 'file', 'json', 'bisa', 'buat', 'mac', 'juga', 'iya', 'install', 'jq', 'biar', 'bisa', 'mainkan', 'file', 'json']","['linux', 'perintah', 'gpt', 'sekarang', 'bisa', 'baca', 'file', 'kasus', 'yang', 'sering', 'pakai', 'format', 'file', 'json', 'sama', 'saring', 'file', 'json', 'bisa', 'buat', 'mac', 'juga', 'iya', 'install', 'jq', 'biar', 'bisa', 'main', 'file', 'json']","['linux', 'perintah', 'gpt', 'baca', 'file', 'pakai', 'format', 'file', 'json', 'saring', 'file', 'json', 'mac', 'iya', 'install', 'biar', 'main', 'file', 'json']",linux perintah gpt baca file pakai format file json saring file json mac iya install biar main file json
chat gpt sua diva,chat gpt sua diva,"['chat', 'gpt', 'sua', 'diva']","['chat', 'gpt', 'sua', 'diva']","['chat', 'gpt', 'sua', 'diva']",chat gpt sua diva
lamun buntu kadang curhat ka chat gpt tp kalimat terahir emang paling bener berani mencoba dan melangkah maju,lamun buntu kadang curhat ka chat gpt tapi kalimat terakhir memang paling benar berani mencoba dan melangkah maju,"['lamun', 'buntu', 'kadang', 'curhat', 'ka', 'chat', 'gpt', 'tapi', 'kalimat', 'terakhir', 'memang', 'paling', 'benar', 'berani', 'mencoba', 'dan', 'melangkah', 'maju']","['lamun', 'buntu', 'kadang', 'curhat', 'ka', 'chat', 'gpt', 'tapi', 'kalimat', 'akhir', 'memang', 'paling', 'benar', 'berani', 'coba', 'dan', 'lang', 'maju']","['lamun', 'buntu', 'kadang', 'curhat', 'chat', 'gpt', 'kalimat', 'berani', 'coba', 'lang', 'maju']",lamun buntu kadang curhat chat gpt kalimat berani coba lang maju
ready nih kak akun chatgpt sharing kbulan bisa akses gpt testimoni bisa cek pinned yahh fast response,siap nih kak akun chatgpt berbagi ke bulan bisa akses gpt testimoni bisa cek disematkan yahh cepat respons,"['siap', 'nih', 'kak', 'akun', 'chatgpt', 'berbagi', 'ke', 'bulan', 'bisa', 'akses', 'gpt', 'testimoni', 'bisa', 'cek', 'disematkan', 'yahh', 'cepat', 'respons']","['siap', 'nih', 'kak', 'akun', 'chatgpt', 'bagi', 'ke', 'bulan', 'bisa', 'akses', 'gpt', 'testimoni', 'bisa', 'cek', 'semat', 'yahh', 'cepat', 'respons']","['kak', 'akun', 'chatgpt', 'akses', 'gpt', 'testimoni', 'cek', 'semat', 'cepat', 'respons']",kak akun chatgpt akses gpt testimoni cek semat cepat respons
ready nih kak akun chatgpt sharing kbulan bisa akses gpt testimoni bisa cek pinned yahh fast response,siap nih kak akun chatgpt berbagi ke bulan bisa akses gpt testimoni bisa cek disematkan yahh cepat respons,"['siap', 'nih', 'kak', 'akun', 'chatgpt', 'berbagi', 'ke', 'bulan', 'bisa', 'akses', 'gpt', 'testimoni', 'bisa', 'cek', 'disematkan', 'yahh', 'cepat', 'respons']","['siap', 'nih', 'kak', 'akun', 'chatgpt', 'bagi', 'ke', 'bulan', 'bisa', 'akses', 'gpt', 'testimoni', 'bisa', 'cek', 'semat', 'yahh', 'cepat', 'respons']","['kak', 'akun', 'chatgpt', 'akses', 'gpt', 'testimoni', 'cek', 'semat', 'cepat', 'respons']",kak akun chatgpt akses gpt testimoni cek semat cepat respons
ceo openai sam altman mengumumkan penambahbaikan yang signifikan pada model kecerdasan buatan gpt untuk meningkatkan kualiti output dan maklum balas sistem baca lagi,ceo openai mas altman mengumumkan penambah baikan yang signifikan pada model kecerdasan buatan gpt untuk meningkatkan kualitas keluaran dan maklum balas sistem baca lagi,"['ceo', 'openai', 'mas', 'altman', 'mengumumkan', 'penambah', 'baikan', 'yang', 'signifikan', 'pada', 'model', 'kecerdasan', 'buatan', 'gpt', 'untuk', 'meningkatkan', 'kualitas', 'keluaran', 'dan', 'maklum', 'balas', 'sistem', 'baca', 'lagi']","['ceo', 'openai', 'mas', 'altman', 'umum', 'tambah', 'baik', 'yang', 'signifikan', 'pada', 'model', 'cerdas', 'buat', 'gpt', 'untuk', 'tingkat', 'kualitas', 'keluar', 'dan', 'maklum', 'balas', 'sistem', 'baca', 'lagi']","['ceo', 'openai', 'mas', 'altman', 'signifikan', 'model', 'cerdas', 'gpt', 'tingkat', 'kualitas', 'maklum', 'balas', 'sistem', 'baca']",ceo openai mas altman signifikan model cerdas gpt tingkat kualitas maklum balas sistem baca
njir gue yang selalu chat gpt upchar pun,njir aku yang selalu chat gpt upchar pun,"['njir', 'aku', 'yang', 'selalu', 'chat', 'gpt', 'upchar', 'pun']","['njir', 'aku', 'yang', 'selalu', 'chat', 'gpt', 'upchar', 'pun']","['chat', 'gpt']",chat gpt
bsdk dikh rhi ki aankhein kharab,bsdk dik rhi ki aankhein kharab,"['bsdk', 'dik', 'rhi', 'ki', 'aankhein', 'kharab']","['bsdk', 'dik', 'rhi', 'ki', 'aankhein', 'kharab']","['dik', 'kharab']",dik kharab
testi cek plagiat turnitin dan cek aigpt,testimoni cek plagiat turnitin dan cek chatgpt,"['testimoni', 'cek', 'plagiat', 'turnitin', 'dan', 'cek', 'chatgpt']","['testimoni', 'cek', 'plagiat', 'turnitin', 'dan', 'cek', 'chatgpt']","['testimoni', 'cek', 'plagiat', 'turnitin', 'cek', 'chatgpt']",testimoni cek plagiat turnitin cek chatgpt
hallo aku open jasa joki tugas pkn pancasila dan kewarganegaraan ya membantu pengerjaan essayartikel bertema soal essaypilgan makalah ppt dll pengerjaan manual full parafrase tanpa aichat gpt testi,halo aku buka jasa joki tugas pekan pancasila dan kewarganegaraan iya membantu pengerjaan essay artikel bertema soal essay pilgan makalah ppt dan lain-lain pengerjaan manual penuh parafrasa tanpa chatbot kecerdasan buatan gpt testimoni,"['halo', 'aku', 'buka', 'jasa', 'joki', 'tugas', 'pekan', 'pancasila', 'dan', 'kewarganegaraan', 'iya', 'membantu', 'pengerjaan', 'essay', 'artikel', 'bertema', 'soal', 'essay', 'pilgan', 'makalah', 'ppt', 'dan', 'lain-lain', 'pengerjaan', 'manual', 'penuh', 'parafrasa', 'tanpa', 'chatbot', 'kecerdasan', 'buatan', 'gpt', 'testimoni']","['halo', 'aku', 'buka', 'jasa', 'joki', 'tugas', 'pekan', 'pancasila', 'dan', 'kewarganegaraan', 'iya', 'bantu', 'kerja', 'essay', 'artikel', 'tema', 'soal', 'essay', 'pilgan', 'makalah', 'ppt', 'dan', 'lain', 'kerja', 'manual', 'penuh', 'parafrasa', 'tanpa', 'chatbot', 'cerdas', 'buat', 'gpt', 'testimoni']","['halo', 'buka', 'jasa', 'joki', 'tugas', 'pekan', 'pancasila', 'kewarganegaraan', 'iya', 'bantu', 'kerja', 'essay', 'artikel', 'tema', 'essay', 'pilgan', 'makalah', 'ppt', 'kerja', 'manual', 'penuh', 'parafrasa', 'chatbot', 'cerdas', 'gpt', 'testimoni']",halo buka jasa joki tugas pekan pancasila kewarganegaraan iya bantu kerja essay artikel tema essay pilgan makalah ppt kerja manual penuh parafrasa chatbot cerdas gpt testimoni
ready nih kak akun chatgpt sharing kbulan bisa akses gpt testimoni bisa cek pinned yahh fast response,siap nih kak akun chatgpt berbagi ke bulan bisa akses gpt testimoni bisa cek disematkan yahh cepat respons,"['siap', 'nih', 'kak', 'akun', 'chatgpt', 'berbagi', 'ke', 'bulan', 'bisa', 'akses', 'gpt', 'testimoni', 'bisa', 'cek', 'disematkan', 'yahh', 'cepat', 'respons']","['siap', 'nih', 'kak', 'akun', 'chatgpt', 'bagi', 'ke', 'bulan', 'bisa', 'akses', 'gpt', 'testimoni', 'bisa', 'cek', 'semat', 'yahh', 'cepat', 'respons']","['kak', 'akun', 'chatgpt', 'akses', 'gpt', 'testimoni', 'cek', 'semat', 'cepat', 'respons']",kak akun chatgpt akses gpt testimoni cek semat cepat respons
morning nya,pagi nya,"['pagi', 'nya']","['pagi', 'nya']",['pagi'],pagi
gw cape bgt ini orang sakit nanya chat gpt ya allah,aku capek banget ini orang sakit tanya chat gpt iya allah,"['aku', 'capek', 'banget', 'ini', 'orang', 'sakit', 'tanya', 'chat', 'gpt', 'iya', 'allah']","['aku', 'capek', 'banget', 'ini', 'orang', 'sakit', 'tanya', 'chat', 'gpt', 'iya', 'allah']","['capek', 'banget', 'orang', 'sakit', 'chat', 'gpt', 'iya', 'allah']",capek banget orang sakit chat gpt iya allah
ada jugak bagi budak-budak nak buat business sana sini etc bukan kata bayar balik selisih pun tak bertegur dah am like relax la aku halalkan je business tak jadi and you dah cuba yang terbaik dah la everyone learned their lessons certainly did,ada juga bagi budak-budak nak buat bisnis sana sini dan sebagainya bukan kata bayar balik selisih pun tak bertegur sudah saya seperti rileks la aku halalkan je bisnis tak jadi dan kamu sudah kuba yang terbaik sudah la semua orang dipelajari mereka pelajaran tentu melakukan,"['ada', 'juga', 'bagi', 'budak-budak', 'nak', 'buat', 'bisnis', 'sana', 'sini', 'dan', 'sebagainya', 'bukan', 'kata', 'bayar', 'balik', 'selisih', 'pun', 'tak', 'bertegur', 'sudah', 'saya', 'seperti', 'rileks', 'la', 'aku', 'halalkan', 'je', 'bisnis', 'tak', 'jadi', 'dan', 'kamu', 'sudah', 'kuba', 'yang', 'terbaik', 'sudah', 'la', 'semua', 'orang', 'dipelajari', 'mereka', 'pelajaran', 'tentu', 'melakukan']","['ada', 'juga', 'bagi', 'budak', 'nak', 'buat', 'bisnis', 'sana', 'sini', 'dan', 'bagai', 'bukan', 'kata', 'bayar', 'balik', 'selisih', 'pun', 'tak', 'tegur', 'sudah', 'saya', 'seperti', 'rileks', 'la', 'aku', 'halal', 'je', 'bisnis', 'tak', 'jadi', 'dan', 'kamu', 'sudah', 'kuba', 'yang', 'baik', 'sudah', 'la', 'semua', 'orang', 'ajar', 'mereka', 'ajar', 'tentu', 'laku']","['budak', 'nak', 'bisnis', 'bayar', 'selisih', 'tegur', 'rileks', 'halal', 'bisnis', 'kuba', 'orang', 'ajar', 'ajar', 'laku']",budak nak bisnis bayar selisih tegur rileks halal bisnis kuba orang ajar ajar laku
kdg ngobrol sm rupeng kyk ngbrl sm chat gpt,kadang mengobrol sama rupeng kayak ngobrol sama chat gpt,"['kadang', 'mengobrol', 'sama', 'rupeng', 'kayak', 'ngobrol', 'sama', 'chat', 'gpt']","['kadang', 'obrol', 'sama', 'rupeng', 'kayak', 'ngobrol', 'sama', 'chat', 'gpt']","['kadang', 'obrol', 'kayak', 'ngobrol', 'chat', 'gpt']",kadang obrol kayak ngobrol chat gpt
gpt jeet,gpt jet,"['gpt', 'jet']","['gpt', 'jet']","['gpt', 'jet']",gpt jet
siang aku masih open joki tugas pkn pancasila amp,siang aku masih buka joki tugas pekan pancasila amp,"['siang', 'aku', 'masih', 'buka', 'joki', 'tugas', 'pekan', 'pancasila', 'amp']","['siang', 'aku', 'masih', 'buka', 'joki', 'tugas', 'pekan', 'pancasila', 'amp']","['siang', 'buka', 'joki', 'tugas', 'pekan', 'pancasila']",siang buka joki tugas pekan pancasila
bio baru tp gpt,bio baru tapi gpt,"['bio', 'baru', 'tapi', 'gpt']","['bio', 'baru', 'tapi', 'gpt']","['bio', 'gpt']",bio gpt
saranku ayo pacaran sama chat gpt,saranku ayo pacaran sama chat gpt,"['saranku', 'ayo', 'pacaran', 'sama', 'chat', 'gpt']","['saran', 'ayo', 'pacar', 'sama', 'chat', 'gpt']","['saran', 'ayo', 'pacar', 'chat', 'gpt']",saran ayo pacar chat gpt
malam aku masih open joki tugas pkn pancasila amp,malam aku masih buka joki tugas pekan pancasila amp,"['malam', 'aku', 'masih', 'buka', 'joki', 'tugas', 'pekan', 'pancasila', 'amp']","['malam', 'aku', 'masih', 'buka', 'joki', 'tugas', 'pekan', 'pancasila', 'amp']","['malam', 'buka', 'joki', 'tugas', 'pekan', 'pancasila']",malam buka joki tugas pekan pancasila
apapun masalahnya chat gpt kuncinya gw,apapun masalahnya chat gpt kuncinya aku,"['apapun', 'masalahnya', 'chat', 'gpt', 'kuncinya', 'aku']","['apa', 'masalah', 'chat', 'gpt', 'kunci', 'aku']","['chat', 'gpt', 'kunci']",chat gpt kunci
prompt gpt gw ancur bgt perkara ketakutan abis mimpi di headlock shownu versi hercules beneran segede itu,prompt gpt aku hancur banget perkara ketakutan habis mimpi di headlock show versi hercules sungguhan sebesar itu,"['prompt', 'gpt', 'aku', 'hancur', 'banget', 'perkara', 'ketakutan', 'habis', 'mimpi', 'di', 'headlock', 'show', 'versi', 'hercules', 'sungguhan', 'sebesar', 'itu']","['prompt', 'gpt', 'aku', 'hancur', 'banget', 'perkara', 'takut', 'habis', 'mimpi', 'di', 'headlock', 'show', 'versi', 'hercules', 'sungguh', 'besar', 'itu']","['prompt', 'gpt', 'hancur', 'banget', 'perkara', 'takut', 'habis', 'mimpi', 'headlock', 'show', 'versi', 'hercules', 'sungguh']",prompt gpt hancur banget perkara takut habis mimpi headlock show versi hercules sungguh
chat gpt kan ya wkwkwk please humor ku sebatas jie ganti usn wv nya,chat gpt kan iya wkwkwk tolong humor ku sebatas jie ganti usn wv nya,"['chat', 'gpt', 'kan', 'iya', 'wkwkwk', 'tolong', 'humor', 'ku', 'sebatas', 'jie', 'ganti', 'usn', 'wv', 'nya']","['chat', 'gpt', 'kan', 'iya', 'wkwkwk', 'tolong', 'humor', 'ku', 'batas', 'jie', 'ganti', 'usn', 'wv', 'nya']","['chat', 'gpt', 'iya', 'tolong', 'humor', 'ku', 'batas', 'ganti']",chat gpt iya tolong humor ku batas ganti
miley cyrus miley cyrus miley cyrus miley cyrus miley cyrus miley cyrus miley cyrus miley cyrus miley cyrus miley cyrus miley cyrus miley cyrus miley cyrus miley cyrus miley cyrus miley cyrus miley cyrus miley cyrus miley cyrus miley cyrus miley cyrus miley cyrus miley cyrus,miley cyrus miley cyrus miley cyrus miley cyrus miley cyrus miley cyrus miley cyrus miley cyrus miley cyrus miley cyrus miley cyrus miley cyrus miley cyrus miley cyrus miley cyrus miley cyrus miley cyrus miley cyrus miley cyrus miley cyrus miley cyrus miley cyrus miley cyrus,"['miley', 'cyrus', 'miley', 'cyrus', 'miley', 'cyrus', 'miley', 'cyrus', 'miley', 'cyrus', 'miley', 'cyrus', 'miley', 'cyrus', 'miley', 'cyrus', 'miley', 'cyrus', 'miley', 'cyrus', 'miley', 'cyrus', 'miley', 'cyrus', 'miley', 'cyrus', 'miley', 'cyrus', 'miley', 'cyrus', 'miley', 'cyrus', 'miley', 'cyrus', 'miley', 'cyrus', 'miley', 'cyrus', 'miley', 'cyrus', 'miley', 'cyrus', 'miley', 'cyrus', 'miley', 'cyrus']","['miley', 'cyrus', 'miley', 'cyrus', 'miley', 'cyrus', 'miley', 'cyrus', 'miley', 'cyrus', 'miley', 'cyrus', 'miley', 'cyrus', 'miley', 'cyrus', 'miley', 'cyrus', 'miley', 'cyrus', 'miley', 'cyrus', 'miley', 'cyrus', 'miley', 'cyrus', 'miley', 'cyrus', 'miley', 'cyrus', 'miley', 'cyrus', 'miley', 'cyrus', 'miley', 'cyrus', 'miley', 'cyrus', 'miley', 'cyrus', 'miley', 'cyrus', 'miley', 'cyrus', 'miley', 'cyrus']","['miley', 'cyrus', 'miley', 'cyrus', 'miley', 'cyrus', 'miley', 'cyrus', 'miley', 'cyrus', 'miley', 'cyrus', 'miley', 'cyrus', 'miley', 'cyrus', 'miley', 'cyrus', 'miley', 'cyrus', 'miley', 'cyrus', 'miley', 'cyrus', 'miley', 'cyrus', 'miley', 'cyrus', 'miley', 'cyrus', 'miley', 'cyrus', 'miley', 'cyrus', 'miley', 'cyrus', 'miley', 'cyrus', 'miley', 'cyrus', 'miley', 'cyrus', 'miley', 'cyrus', 'miley', 'cyrus']",miley cyrus miley cyrus miley cyrus miley cyrus miley cyrus miley cyrus miley cyrus miley cyrus miley cyrus miley cyrus miley cyrus miley cyrus miley cyrus miley cyrus miley cyrus miley cyrus miley cyrus miley cyrus miley cyrus miley cyrus miley cyrus miley cyrus miley cyrus
nah ini baru knp nilai apakah pas uo yg benernya cuma sedikit atau pas utm banyak soal yg sulit atau pas the banyak yg copas dari chat gptartikel sampe terindikasi plagiat pas ujian ketauan nyontekbuka hp,nah ini baru kenapa nilai apakah pas uo yang benarnya cuma sedikit atau pas universitas trunojoyo madura banyak soal yang sulit atau pas the banyak yang duplikat dari chat gpt artikel sampai terindikasi plagiat pas ujian ketahuan mencontoh hp,"['nah', 'ini', 'baru', 'kenapa', 'nilai', 'apakah', 'pas', 'uo', 'yang', 'benarnya', 'cuma', 'sedikit', 'atau', 'pas', 'universitas', 'trunojoyo', 'madura', 'banyak', 'soal', 'yang', 'sulit', 'atau', 'pas', 'the', 'banyak', 'yang', 'duplikat', 'dari', 'chat', 'gpt', 'artikel', 'sampai', 'terindikasi', 'plagiat', 'pas', 'ujian', 'ketahuan', 'mencontoh', 'hp']","['nah', 'ini', 'baru', 'kenapa', 'nilai', 'apakah', 'pas', 'uo', 'yang', 'benar', 'cuma', 'sedikit', 'atau', 'pas', 'universitas', 'trunojoyo', 'madura', 'banyak', 'soal', 'yang', 'sulit', 'atau', 'pas', 'the', 'banyak', 'yang', 'duplikat', 'dari', 'chat', 'gpt', 'artikel', 'sampai', 'indikasi', 'plagiat', 'pas', 'uji', 'tahu', 'contoh', 'hp']","['nilai', 'pas', 'pas', 'universitas', 'trunojoyo', 'madura', 'sulit', 'pas', 'duplikat', 'chat', 'gpt', 'artikel', 'indikasi', 'plagiat', 'pas', 'uji', 'contoh', 'hp']",nilai pas pas universitas trunojoyo madura sulit pas duplikat chat gpt artikel indikasi plagiat pas uji contoh hp
masa gw chat gpt,masak aku chat gpt,"['masak', 'aku', 'chat', 'gpt']","['masak', 'aku', 'chat', 'gpt']","['masak', 'chat', 'gpt']",masak chat gpt
ini der jawaban dari chat gpt,ini der jawaban dari chat gpt,"['ini', 'der', 'jawaban', 'dari', 'chat', 'gpt']","['ini', 'der', 'jawab', 'dari', 'chat', 'gpt']","['chat', 'gpt']",chat gpt
ready nih kak akun chatgpt sharing kbulan bisa akses gpt testimoni bisa cek pinned yahh fast response,siap nih kak akun chatgpt berbagi ke bulan bisa akses gpt testimoni bisa cek disematkan yahh cepat respons,"['siap', 'nih', 'kak', 'akun', 'chatgpt', 'berbagi', 'ke', 'bulan', 'bisa', 'akses', 'gpt', 'testimoni', 'bisa', 'cek', 'disematkan', 'yahh', 'cepat', 'respons']","['siap', 'nih', 'kak', 'akun', 'chatgpt', 'bagi', 'ke', 'bulan', 'bisa', 'akses', 'gpt', 'testimoni', 'bisa', 'cek', 'semat', 'yahh', 'cepat', 'respons']","['kak', 'akun', 'chatgpt', 'akses', 'gpt', 'testimoni', 'cek', 'semat', 'cepat', 'respons']",kak akun chatgpt akses gpt testimoni cek semat cepat respons
mayli bratlar gpt dedik aslida undan foydalanish zor faqat hukm chiqarmoqchi bolsangiz qaysidir masalada mutaxassisligingizdan kelib chiqib qiling mutaxassisligingizga kerakli joyida foydalansangiz yaxshi shuni uchun ozingizga kerak joyidan foydalaning faqihlik qilmasdan,mayli bratlar gpt dedik nyatanya undan foydalanish zor faqat hukum chiqarmoqchi bolsangiz qaysidir masalada mutaxassisligingizdan kelib chiqib qiling mutaxassisligingizga kerakli joyida foydalansangiz yaxshi shuni uchun ozingizga kerak joyidan foydalaning faqihlik qilmasdan,"['mayli', 'bratlar', 'gpt', 'dedik', 'nyatanya', 'undan', 'foydalanish', 'zor', 'faqat', 'hukum', 'chiqarmoqchi', 'bolsangiz', 'qaysidir', 'masalada', 'mutaxassisligingizdan', 'kelib', 'chiqib', 'qiling', 'mutaxassisligingizga', 'kerakli', 'joyida', 'foydalansangiz', 'yaxshi', 'shuni', 'uchun', 'ozingizga', 'kerak', 'joyidan', 'foydalaning', 'faqihlik', 'qilmasdan']","['mayli', 'bratlar', 'gpt', 'dedik', 'nyata', 'undan', 'foydalanish', 'zor', 'faqat', 'hukum', 'chiqarmoqchi', 'bolsangiz', 'qaysidir', 'masalada', 'mutaxassisligingizdan', 'kelib', 'chiqib', 'qiling', 'mutaxassisligingizga', 'kerakli', 'joyida', 'foydalansangiz', 'yaxshi', 'shuni', 'uchun', 'ozingizga', 'kerak', 'joyidan', 'foydalaning', 'faqihlik', 'qilmasdan']","['gpt', 'dedik', 'nyata', 'hukum', 'kerak']",gpt dedik nyata hukum kerak
ready nih kak akun chatgpt sharing kbulan bisa akses gpt testimoni bisa cek pinned yahh fast response,siap nih kak akun chatgpt berbagi ke bulan bisa akses gpt testimoni bisa cek disematkan yahh cepat respons,"['siap', 'nih', 'kak', 'akun', 'chatgpt', 'berbagi', 'ke', 'bulan', 'bisa', 'akses', 'gpt', 'testimoni', 'bisa', 'cek', 'disematkan', 'yahh', 'cepat', 'respons']","['siap', 'nih', 'kak', 'akun', 'chatgpt', 'bagi', 'ke', 'bulan', 'bisa', 'akses', 'gpt', 'testimoni', 'bisa', 'cek', 'semat', 'yahh', 'cepat', 'respons']","['kak', 'akun', 'chatgpt', 'akses', 'gpt', 'testimoni', 'cek', 'semat', 'cepat', 'respons']",kak akun chatgpt akses gpt testimoni cek semat cepat respons
teh ida lgi nanya gpt mau jawab kyk gmna,teh ida lagi tanya gpt mau jawab kayak bagaimana,"['teh', 'ida', 'lagi', 'tanya', 'gpt', 'mau', 'jawab', 'kayak', 'bagaimana']","['teh', 'ida', 'lagi', 'tanya', 'gpt', 'mau', 'jawab', 'kayak', 'bagaimana']","['teh', 'ida', 'gpt', 'kayak']",teh ida gpt kayak
gelora bang toyib,gelora bang toyib,"['gelora', 'bang', 'toyib']","['gelora', 'bang', 'toyib']","['gelora', 'bang', 'toyib']",gelora bang toyib
selalu tak bila baca buku tak lama lepas tu lupa dah semua penat rasa macam buang masa je baca buku kan sebabnya takde sapa ajar kita macam mana cara membaca yang betul siot ni meh saya ajar senang ada benda je kena ingat kena tau kenapa kita baca buku,selalu tak bila baca buku tak lama lepas tu lupa sudah semua penat rasa macam buang masak je baca buku kan sebabnya tidak ada sapa ajar kita macam mana cara membaca yang betul siot ni hampir saya ajar senang ada benda je kena ingat kena tahu kenapa kita baca buku,"['selalu', 'tak', 'bila', 'baca', 'buku', 'tak', 'lama', 'lepas', 'tu', 'lupa', 'sudah', 'semua', 'penat', 'rasa', 'macam', 'buang', 'masak', 'je', 'baca', 'buku', 'kan', 'sebabnya', 'tidak', 'ada', 'sapa', 'ajar', 'kita', 'macam', 'mana', 'cara', 'membaca', 'yang', 'betul', 'siot', 'ni', 'hampir', 'saya', 'ajar', 'senang', 'ada', 'benda', 'je', 'kena', 'ingat', 'kena', 'tahu', 'kenapa', 'kita', 'baca', 'buku']","['selalu', 'tak', 'bila', 'baca', 'buku', 'tak', 'lama', 'lepas', 'tu', 'lupa', 'sudah', 'semua', 'penat', 'rasa', 'macam', 'buang', 'masak', 'je', 'baca', 'buku', 'kan', 'sebab', 'tidak', 'ada', 'sapa', 'ajar', 'kita', 'macam', 'mana', 'cara', 'baca', 'yang', 'betul', 'siot', 'ni', 'hampir', 'saya', 'ajar', 'senang', 'ada', 'benda', 'je', 'kena', 'ingat', 'kena', 'tahu', 'kenapa', 'kita', 'baca', 'buku']","['baca', 'buku', 'lepas', 'lupa', 'penat', 'buang', 'masak', 'baca', 'buku', 'sapa', 'ajar', 'baca', 'ajar', 'senang', 'benda', 'kena', 'kena', 'baca', 'buku']",baca buku lepas lupa penat buang masak baca buku sapa ajar baca ajar senang benda kena kena baca buku
