text_cleaning,slang_removal,tokenization,stemming,stopword_removal,final
tidak melampau untuk mengatakan openai mempopularkan penggunaan chatbot kecerdasan buatan ai dalam aktiviti harian,tidak melampau untuk mengatakan openai memopulerkan penggunaan chatbot kecerdasan buatan kecerdasan buatan dalam aktivitas harian,"['tidak', 'melampau', 'untuk', 'mengatakan', 'openai', 'memopulerkan', 'penggunaan', 'chatbot', 'kecerdasan', 'buatan', 'kecerdasan', 'buatan', 'dalam', 'aktivitas', 'harian']","['tidak', 'lampau', 'untuk', 'kata', 'openai', 'populer', 'guna', 'chatbot', 'cerdas', 'buat', 'cerdas', 'buat', 'dalam', 'aktivitas', 'hari']","['lampau', 'openai', 'populer', 'chatbot', 'cerdas', 'cerdas', 'aktivitas']",lampau openai populer chatbot cerdas cerdas aktivitas
openai,openai,['openai'],['openai'],['openai'],openai
nokos buat verif openai doonggg,nokos buat verifikasi openai doonggg,"['nokos', 'buat', 'verifikasi', 'openai', 'doonggg']","['nokos', 'buat', 'verifikasi', 'openai', 'doonggg']","['verifikasi', 'openai']",verifikasi openai
openai gotta stop yapping,openai harus berhenti menyalak,"['openai', 'harus', 'berhenti', 'menyalak']","['openai', 'harus', 'henti', 'salak']","['openai', 'henti', 'salak']",openai henti salak
rumor openai bai,rumor openai bai,"['rumor', 'openai', 'bai']","['rumor', 'openai', 'bai']","['rumor', 'openai']",rumor openai
wtb nomer kosong buat verif openai,want to buy nomor kosong buat verifikasi openai,"['want', 'to', 'buy', 'nomor', 'kosong', 'buat', 'verifikasi', 'openai']","['want', 'to', 'buy', 'nomor', 'kosong', 'buat', 'verifikasi', 'openai']","['want', 'to', 'buy', 'nomor', 'kosong', 'verifikasi', 'openai']",want to buy nomor kosong verifikasi openai
openai bill,openai bill,"['openai', 'bill']","['openai', 'bill']","['openai', 'bill']",openai bill
or from openai import openai,atau dari openai impor openai,"['atau', 'dari', 'openai', 'impor', 'openai']","['atau', 'dari', 'openai', 'impor', 'openai']","['openai', 'impor', 'openai']",openai impor openai
tuhan tidak memberikan hambanya pekerjaan yang tidak bisa mereka kerjakan oleh karena itu tuhan menciptakan manusia yang kemudian menciptakan openai dan kemudian menciptakan chatgpt respect god menyalaa tuhanku,tuhan tidak memberikan hambanya pekerjaan yang tidak bisa mereka kerjakan oleh karena itu tuhan menciptakan manusia yang kemudian menciptakan openai dan kemudian menciptakan chatgpt respek tuhan menyala tuhanku,"['tuhan', 'tidak', 'memberikan', 'hambanya', 'pekerjaan', 'yang', 'tidak', 'bisa', 'mereka', 'kerjakan', 'oleh', 'karena', 'itu', 'tuhan', 'menciptakan', 'manusia', 'yang', 'kemudian', 'menciptakan', 'openai', 'dan', 'kemudian', 'menciptakan', 'chatgpt', 'respek', 'tuhan', 'menyala', 'tuhanku']","['tuhan', 'tidak', 'beri', 'hamba', 'kerja', 'yang', 'tidak', 'bisa', 'mereka', 'kerja', 'oleh', 'karena', 'itu', 'tuhan', 'cipta', 'manusia', 'yang', 'kemudian', 'cipta', 'openai', 'dan', 'kemudian', 'cipta', 'chatgpt', 'respek', 'tuhan', 'nyala', 'tuhan']","['tuhan', 'hamba', 'kerja', 'kerja', 'tuhan', 'cipta', 'manusia', 'cipta', 'openai', 'cipta', 'chatgpt', 'respek', 'tuhan', 'nyala', 'tuhan']",tuhan hamba kerja kerja tuhan cipta manusia cipta openai cipta chatgpt respek tuhan nyala tuhan
oh enggak ini ada license masing di web openai dijelaskan kok jd mereka ga asal masukin data ke llm mereka twitter atau web pun nanti masuk kategori mn sdh mereka atur makanya pas kita sign up twitter disitu jg diatur bahwa twitter ada akses ke akun kita ini yg digunain,oh enggak ini ada izin masing di web openai dijelaskan kok jadi mereka tidak asal masukkan data ke llm mereka twitter atau web pun nanti masuk kategori mana sudah mereka atur makanya pas kita tanda naik twitter di situ juga diatur bahwa twitter ada akses ke akun kita ini yang digunakan,"['oh', 'enggak', 'ini', 'ada', 'izin', 'masing', 'di', 'web', 'openai', 'dijelaskan', 'kok', 'jadi', 'mereka', 'tidak', 'asal', 'masukkan', 'data', 'ke', 'llm', 'mereka', 'twitter', 'atau', 'web', 'pun', 'nanti', 'masuk', 'kategori', 'mana', 'sudah', 'mereka', 'atur', 'makanya', 'pas', 'kita', 'tanda', 'naik', 'twitter', 'di', 'situ', 'juga', 'diatur', 'bahwa', 'twitter', 'ada', 'akses', 'ke', 'akun', 'kita', 'ini', 'yang', 'digunakan']","['oh', 'enggak', 'ini', 'ada', 'izin', 'masing', 'di', 'web', 'openai', 'jelas', 'kok', 'jadi', 'mereka', 'tidak', 'asal', 'masuk', 'data', 'ke', 'llm', 'mereka', 'twitter', 'atau', 'web', 'pun', 'nanti', 'masuk', 'kategori', 'mana', 'sudah', 'mereka', 'atur', 'makanya', 'pas', 'kita', 'tanda', 'naik', 'twitter', 'di', 'situ', 'juga', 'atur', 'bahwa', 'twitter', 'ada', 'akses', 'ke', 'akun', 'kita', 'ini', 'yang', 'guna']","['izin', 'web', 'openai', 'masuk', 'data', 'twitter', 'web', 'masuk', 'kategori', 'atur', 'pas', 'tanda', 'twitter', 'situ', 'atur', 'twitter', 'akses', 'akun']",izin web openai masuk data twitter web masuk kategori atur pas tanda twitter situ atur twitter akses akun
github repo scaling openai using apim ptus and tpms,github repository penskalaan openai menggunakan apim ptus dan tpms,"['github', 'repository', 'penskalaan', 'openai', 'menggunakan', 'apim', 'ptus', 'dan', 'tpms']","['github', 'repository', 'penskalaan', 'openai', 'guna', 'apim', 'ptus', 'dan', 'tpms']","['github', 'repository', 'penskalaan', 'openai']",github repository penskalaan openai
openai sedang membangunkan ai yang boleh mengawal sesebuah peranti bagi menggantikan pekerja manusia,openai sedang membangunkan kecerdasan buatan yang boleh mengawal sebuah peranti bagi menggantikan pekerja manusia,"['openai', 'sedang', 'membangunkan', 'kecerdasan', 'buatan', 'yang', 'boleh', 'mengawal', 'sebuah', 'peranti', 'bagi', 'menggantikan', 'pekerja', 'manusia']","['openai', 'sedang', 'bangun', 'cerdas', 'buat', 'yang', 'boleh', 'awal', 'buah', 'peranti', 'bagi', 'ganti', 'kerja', 'manusia']","['openai', 'bangun', 'cerdas', 'buah', 'peranti', 'ganti', 'kerja', 'manusia']",openai bangun cerdas buah peranti ganti kerja manusia
saya meminta ke openai untuk mencarikan filsuf-filsuf yang paling serasi dengan kandidat capres lalu membuat ilustrasi masing-masing dari mereka hasilnya adalah ganjar pranowo amp,saya meminta ke openai untuk mencarikan filsuf-filsuf yang paling serasi dengan kandidat calon presiden lalu membuat ilustrasi masing-masing dari mereka hasilnya adalah ganjar pranowo amp,"['saya', 'meminta', 'ke', 'openai', 'untuk', 'mencarikan', 'filsuf-filsuf', 'yang', 'paling', 'serasi', 'dengan', 'kandidat', 'calon', 'presiden', 'lalu', 'membuat', 'ilustrasi', 'masing-masing', 'dari', 'mereka', 'hasilnya', 'adalah', 'ganjar', 'pranowo', 'amp']","['saya', 'minta', 'ke', 'openai', 'untuk', 'cari', 'filsuf', 'yang', 'paling', 'serasi', 'dengan', 'kandidat', 'calon', 'presiden', 'lalu', 'buat', 'ilustrasi', 'masing-masing', 'dari', 'mereka', 'hasil', 'adalah', 'ganjar', 'pranowo', 'amp']","['openai', 'cari', 'filsuf', 'serasi', 'kandidat', 'calon', 'presiden', 'ilustrasi', 'hasil', 'ganjar', 'pranowo']",openai cari filsuf serasi kandidat calon presiden ilustrasi hasil ganjar pranowo
openai,openai,['openai'],['openai'],['openai'],openai
dalle from openai aka,dall e dari openai alias,"['dall', 'e', 'dari', 'openai', 'alias']","['dall', 'e', 'dari', 'openai', 'alias']","['dall', 'e', 'openai', 'alias']",dall e openai alias
openai microsoft,openai microsoft,"['openai', 'microsoft']","['openai', 'microsoft']","['openai', 'microsoft']",openai microsoft
openai cheatsheet,openai contekan,"['openai', 'contekan']","['openai', 'contek']","['openai', 'contek']",openai contek
openai hits bln revenue milestone ft,openai hit bulan pendapatan tonggak sejarah ft,"['openai', 'hit', 'bulan', 'pendapatan', 'tonggak', 'sejarah', 'ft']","['openai', 'hit', 'bulan', 'dapat', 'tonggak', 'sejarah', 'ft']","['openai', 'hit', 'tonggak', 'sejarah']",openai hit tonggak sejarah
openai hits bln revenue milestone ft,openai hit bulan pendapatan tonggak sejarah ft,"['openai', 'hit', 'bulan', 'pendapatan', 'tonggak', 'sejarah', 'ft']","['openai', 'hit', 'bulan', 'dapat', 'tonggak', 'sejarah', 'ft']","['openai', 'hit', 'tonggak', 'sejarah']",openai hit tonggak sejarah
meta akan mulai memberi label pada gambar yang dihasilkan ai dari openai google dan lainnya,meta akan mulai memberi label pada gambar yang dihasilkan kecerdasan buatan dari openai google dan lainnya,"['meta', 'akan', 'mulai', 'memberi', 'label', 'pada', 'gambar', 'yang', 'dihasilkan', 'kecerdasan', 'buatan', 'dari', 'openai', 'google', 'dan', 'lainnya']","['meta', 'akan', 'mulai', 'beri', 'label', 'pada', 'gambar', 'yang', 'hasil', 'cerdas', 'buat', 'dari', 'openai', 'google', 'dan', 'lain']","['meta', 'label', 'gambar', 'hasil', 'cerdas', 'openai', 'google']",meta label gambar hasil cerdas openai google
- marketing va umuman itwebsmm sohasida ishlovchilar uchun servis hozircha bepul qr kod bio-sahifa qisqa havola yaratish va barchasini analiz qilishdan tashqari openai orqali sayt reklama uchun oyalar generatsiya qilsa bo ladi hozircha bepul,- pemasaran va umum itwebsmm sohasida ishlovchilar uchun layanan hozircha bepul qr kod bio sahifa qisqa havola yaratish va mereka semua analis qilishdan tashqari openai orqali sayt reklama uchun oyalar generasinya qilsa bo ladi hozircha bepul,"['-', 'pemasaran', 'va', 'umum', 'itwebsmm', 'sohasida', 'ishlovchilar', 'uchun', 'layanan', 'hozircha', 'bepul', 'qr', 'kod', 'bio', 'sahifa', 'qisqa', 'havola', 'yaratish', 'va', 'mereka', 'semua', 'analis', 'qilishdan', 'tashqari', 'openai', 'orqali', 'sayt', 'reklama', 'uchun', 'oyalar', 'generasinya', 'qilsa', 'bo', 'ladi', 'hozircha', 'bepul']","['-', 'pasar', 'va', 'umum', 'itwebsmm', 'sohasida', 'ishlovchilar', 'uchun', 'layan', 'hozircha', 'bepul', 'qr', 'kod', 'bio', 'sahifa', 'qisqa', 'havola', 'yaratish', 'va', 'mereka', 'semua', 'analis', 'qilishdan', 'tashqari', 'openai', 'orqali', 'sayt', 'reklama', 'uchun', 'oyalar', 'generasi', 'qilsa', 'bo', 'ladi', 'hozircha', 'bepul']","['-', 'pasar', 'layan', 'qr', 'bio', 'sahifa', 'yaratish', 'analis', 'openai', 'reklama', 'generasi', 'ladi']",- pasar layan qr bio sahifa yaratish analis openai reklama generasi ladi
asal usul sound system horeg menurut dari,asal usul suara sistem horeg menurut dari,"['asal', 'usul', 'suara', 'sistem', 'horeg', 'menurut', 'dari']","['asal', 'usul', 'suara', 'sistem', 'horeg', 'turut', 'dari']","['usul', 'suara', 'sistem']",usul suara sistem
ai generated photos stabilityai stable-diffusion-- openai dall midjourney prompt clear weather in qiqihar china,kecerdasan buatan yang dihasilkan fotor stabilitas ai difusi stabil openai dall midjourney prompt jernih cuaca di qiqihar china,"['kecerdasan', 'buatan', 'yang', 'dihasilkan', 'fotor', 'stabilitas', 'ai', 'difusi', 'stabil', 'openai', 'dall', 'midjourney', 'prompt', 'jernih', 'cuaca', 'di', 'qiqihar', 'china']","['cerdas', 'buat', 'yang', 'hasil', 'fotor', 'stabilitas', 'ai', 'difusi', 'stabil', 'openai', 'dall', 'midjourney', 'prompt', 'jernih', 'cuaca', 'di', 'qiqihar', 'china']","['cerdas', 'hasil', 'fotor', 'stabilitas', 'ai', 'difusi', 'stabil', 'openai', 'dall', 'midjourney', 'prompt', 'jernih', 'cuaca', 'china']",cerdas hasil fotor stabilitas ai difusi stabil openai dall midjourney prompt jernih cuaca china
mungkin gov boleh jemput pakar drp dll bekerjasama dgn pakar tempatan dan hasilkan dasar amp,mungkin gov boleh jemput pakar daripada dan lain-lain bekerja sama dengan pakar tempatan dan hasilkan dasar amp,"['mungkin', 'gov', 'boleh', 'jemput', 'pakar', 'daripada', 'dan', 'lain-lain', 'bekerja', 'sama', 'dengan', 'pakar', 'tempatan', 'dan', 'hasilkan', 'dasar', 'amp']","['mungkin', 'gov', 'boleh', 'jemput', 'pakar', 'daripada', 'dan', 'lain', 'kerja', 'sama', 'dengan', 'pakar', 'tempat', 'dan', 'hasil', 'dasar', 'amp']","['jemput', 'pakar', 'kerja', 'pakar', 'hasil', 'dasar']",jemput pakar kerja pakar hasil dasar
openai superbowl ad coming,openai super bowl ad yang akan datang,"['openai', 'super', 'bowl', 'ad', 'yang', 'akan', 'datang']","['openai', 'super', 'bowl', 'ad', 'yang', 'akan', 'datang']","['openai', 'super', 'bowl']",openai super bowl
ada yg jual api key openai,ada yang jual api kunci openai,"['ada', 'yang', 'jual', 'api', 'kunci', 'openai']","['ada', 'yang', 'jual', 'api', 'kunci', 'openai']","['jual', 'api', 'kunci', 'openai']",jual api kunci openai
openai larp,openai larp,"['openai', 'larp']","['openai', 'larp']",['openai'],openai
ceo openai chatgpt gpt kini sepatutnya kurang malas,ceo openai chatgpt gpt kini sepatutnya kurang malas,"['ceo', 'openai', 'chatgpt', 'gpt', 'kini', 'sepatutnya', 'kurang', 'malas']","['ceo', 'openai', 'chatgpt', 'gpt', 'kini', 'patut', 'kurang', 'malas']","['ceo', 'openai', 'chatgpt', 'gpt', 'patut', 'malas']",ceo openai chatgpt gpt patut malas
ceo openai sam altman mengumumkan penambahbaikan yang signifikan pada model kecerdasan buatan gpt untuk meningkatkan kualiti output dan maklum balas sistem baca lagi,ceo openai mas altman mengumumkan penambah baikan yang signifikan pada model kecerdasan buatan gpt untuk meningkatkan kualitas keluaran dan maklum balas sistem baca lagi,"['ceo', 'openai', 'mas', 'altman', 'mengumumkan', 'penambah', 'baikan', 'yang', 'signifikan', 'pada', 'model', 'kecerdasan', 'buatan', 'gpt', 'untuk', 'meningkatkan', 'kualitas', 'keluaran', 'dan', 'maklum', 'balas', 'sistem', 'baca', 'lagi']","['ceo', 'openai', 'mas', 'altman', 'umum', 'tambah', 'baik', 'yang', 'signifikan', 'pada', 'model', 'cerdas', 'buat', 'gpt', 'untuk', 'tingkat', 'kualitas', 'keluar', 'dan', 'maklum', 'balas', 'sistem', 'baca', 'lagi']","['ceo', 'openai', 'mas', 'altman', 'signifikan', 'model', 'cerdas', 'gpt', 'tingkat', 'kualitas', 'maklum', 'balas', 'sistem', 'baca']",ceo openai mas altman signifikan model cerdas gpt tingkat kualitas maklum balas sistem baca
openai compatibility,openai kesesuaian,"['openai', 'kesesuaian']","['openai', 'sesuai']","['openai', 'sesuai']",openai sesuai
google bard vs openai chatgpt vs microsoft copilot hmmmmm,google penyair versus openai chatgpt versus microsoft copilot hmmmmm,"['google', 'penyair', 'versus', 'openai', 'chatgpt', 'versus', 'microsoft', 'copilot', 'hmmmmm']","['google', 'sair', 'versus', 'openai', 'chatgpt', 'versus', 'microsoft', 'copilot', 'hmmmmm']","['google', 'sair', 'versus', 'openai', 'chatgpt', 'versus', 'microsoft', 'copilot']",google sair versus openai chatgpt versus microsoft copilot
openai compatibility ollama blog,openai kesesuaian ollama blog,"['openai', 'kesesuaian', 'ollama', 'blog']","['openai', 'sesuai', 'ollama', 'blog']","['openai', 'sesuai', 'blog']",openai sesuai blog
apakah ada yang diinputkan ke openai nya sehingga didapat keserasian seperti hasil tersebut,apakah ada yang dimasukkan ke openai nya sehingga didapat keserasian seperti hasil tersebut,"['apakah', 'ada', 'yang', 'dimasukkan', 'ke', 'openai', 'nya', 'sehingga', 'didapat', 'keserasian', 'seperti', 'hasil', 'tersebut']","['apakah', 'ada', 'yang', 'masuk', 'ke', 'openai', 'nya', 'sehingga', 'dapat', 'serasi', 'seperti', 'hasil', 'sebut']","['masuk', 'openai', 'serasi', 'hasil']",masuk openai serasi hasil
wen openai mfa,wen openai mfa,"['wen', 'openai', 'mfa']","['wen', 'openai', 'mfa']",['openai'],openai
openai paper,openai kertas,"['openai', 'kertas']","['openai', 'kertas']","['openai', 'kertas']",openai kertas
cpa in dalle openai help center,siapa di dall e openai tolong tengah,"['siapa', 'di', 'dall', 'e', 'openai', 'tolong', 'tengah']","['siapa', 'di', 'dall', 'e', 'openai', 'tolong', 'tengah']","['dall', 'e', 'openai', 'tolong']",dall e openai tolong
openai compatibility,openai kesesuaian,"['openai', 'kesesuaian']","['openai', 'sesuai']","['openai', 'sesuai']",openai sesuai
openai compatibility,openai kesesuaian,"['openai', 'kesesuaian']","['openai', 'sesuai']","['openai', 'sesuai']",openai sesuai
banyak alat ai yang digunakan dalam pemilu di indonesia didukung oleh openai kata sembilan staf kampanye senior kepada reuters alat itu termasuk platform prabowo menurut koordinator tim digitalnya,banyak alat kecerdasan buatan yang digunakan dalam pemilu di indonesia didukung oleh openai kata sembilan staf kampanye senior kepada reuters alat itu termasuk platform prabowo menurut koordinator tim digitalnya,"['banyak', 'alat', 'kecerdasan', 'buatan', 'yang', 'digunakan', 'dalam', 'pemilu', 'di', 'indonesia', 'didukung', 'oleh', 'openai', 'kata', 'sembilan', 'staf', 'kampanye', 'senior', 'kepada', 'reuters', 'alat', 'itu', 'termasuk', 'platform', 'prabowo', 'menurut', 'koordinator', 'tim', 'digitalnya']","['banyak', 'alat', 'cerdas', 'buat', 'yang', 'guna', 'dalam', 'pemilu', 'di', 'indonesia', 'dukung', 'oleh', 'openai', 'kata', 'sembilan', 'staf', 'kampanye', 'senior', 'kepada', 'reuters', 'alat', 'itu', 'masuk', 'platform', 'prabowo', 'turut', 'koordinator', 'tim', 'digital']","['alat', 'cerdas', 'pemilu', 'indonesia', 'dukung', 'openai', 'sembilan', 'staf', 'kampanye', 'senior', 'alat', 'masuk', 'platform', 'prabowo', 'koordinator', 'tim', 'digital']",alat cerdas pemilu indonesia dukung openai sembilan staf kampanye senior alat masuk platform prabowo koordinator tim digital
openai,openai,['openai'],['openai'],['openai'],openai
msft pre openai hits bln revenue milestone ft,msft pre openai hit bulan pendapatan tonggak sejarah ft,"['msft', 'pre', 'openai', 'hit', 'bulan', 'pendapatan', 'tonggak', 'sejarah', 'ft']","['msft', 'pre', 'openai', 'hit', 'bulan', 'dapat', 'tonggak', 'sejarah', 'ft']","['pre', 'openai', 'hit', 'tonggak', 'sejarah']",pre openai hit tonggak sejarah
lalu kenapa elon musk keluar dari openai simak cerita lengkapnya di sini,lalu kenapa elon musk keluar dari openai simak cerita lengkapnya di sini,"['lalu', 'kenapa', 'elon', 'musk', 'keluar', 'dari', 'openai', 'simak', 'cerita', 'lengkapnya', 'di', 'sini']","['lalu', 'kenapa', 'elon', 'musk', 'keluar', 'dari', 'openai', 'simak', 'cerita', 'lengkap', 'di', 'sini']","['elon', 'musk', 'openai', 'simak', 'cerita', 'lengkap']",elon musk openai simak cerita lengkap
cpa in dalle openai help center,siapa di dall e openai tolong tengah,"['siapa', 'di', 'dall', 'e', 'openai', 'tolong', 'tengah']","['siapa', 'di', 'dall', 'e', 'openai', 'tolong', 'tengah']","['dall', 'e', 'openai', 'tolong']",dall e openai tolong
nah openai is cooked,nah openai adalah matang,"['nah', 'openai', 'adalah', 'matang']","['nah', 'openai', 'adalah', 'matang']","['openai', 'matang']",openai matang
hebat banget bahwa kamu menggunakan gpt untuk analisa kecocokkan resume kalau kamu tertarik untuk eksplorasi lebih jauh dengan custom gpt-mu cek platform kita kamu bisa share kreasi ai-mu dengan komunitas yang bersemangat,hebat banget bahwa kamu menggunakan gpt untuk analisis kecocokkan melanjutkan kalau kamu tertarik untuk eksplorasi lebih jauh dengan kebiasaan gpt-mu cek platform kita kamu bisa bagikan kreasi kecerdasan buatan dengan komunitas yang bersemangat,"['hebat', 'banget', 'bahwa', 'kamu', 'menggunakan', 'gpt', 'untuk', 'analisis', 'kecocokkan', 'melanjutkan', 'kalau', 'kamu', 'tertarik', 'untuk', 'eksplorasi', 'lebih', 'jauh', 'dengan', 'kebiasaan', 'gpt-mu', 'cek', 'platform', 'kita', 'kamu', 'bisa', 'bagikan', 'kreasi', 'kecerdasan', 'buatan', 'dengan', 'komunitas', 'yang', 'bersemangat']","['hebat', 'banget', 'bahwa', 'kamu', 'guna', 'gpt', 'untuk', 'analisis', 'cocok', 'lanjut', 'kalau', 'kamu', 'tarik', 'untuk', 'eksplorasi', 'lebih', 'jauh', 'dengan', 'biasa', 'gpt-mu', 'cek', 'platform', 'kita', 'kamu', 'bisa', 'bagi', 'kreasi', 'cerdas', 'buat', 'dengan', 'komunitas', 'yang', 'semangat']","['hebat', 'banget', 'gpt', 'analisis', 'cocok', 'tarik', 'eksplorasi', 'gpt-mu', 'cek', 'platform', 'kreasi', 'cerdas', 'komunitas', 'semangat']",hebat banget gpt analisis cocok tarik eksplorasi gpt-mu cek platform kreasi cerdas komunitas semangat
kes mk ya bilir zeka,kes mk iya bilir zeka,"['kes', 'mk', 'iya', 'bilir', 'zeka']","['kes', 'mk', 'iya', 'bilir', 'zeka']","['iya', 'zeka']",iya zeka
ai non profit safety organisation,kecerdasan buatan non profit keamanan organisasi,"['kecerdasan', 'buatan', 'non', 'profit', 'keamanan', 'organisasi']","['cerdas', 'buat', 'non', 'profit', 'aman', 'organisasi']","['cerdas', 'non', 'profit', 'aman', 'organisasi']",cerdas non profit aman organisasi
ollama releases openai api compatibility,ollama rilis openai api kesesuaian,"['ollama', 'rilis', 'openai', 'api', 'kesesuaian']","['ollama', 'rilis', 'openai', 'api', 'sesuai']","['rilis', 'openai', 'api', 'sesuai']",rilis openai api sesuai
openai in ufahdhaa photo thah water mark kuran nimmaifi,openai di ufahdhaa foto thah air tanda kuran nimmaifi,"['openai', 'di', 'ufahdhaa', 'foto', 'thah', 'air', 'tanda', 'kuran', 'nimmaifi']","['openai', 'di', 'ufahdhaa', 'foto', 'thah', 'air', 'tanda', 'kur', 'nimmaifi']","['openai', 'foto', 'air', 'tanda', 'kur']",openai foto air tanda kur
openai is ngmi,openai adalah ngmi,"['openai', 'adalah', 'ngmi']","['openai', 'adalah', 'ngmi']",['openai'],openai
embeddings openai api,menyematkan openai api,"['menyematkan', 'openai', 'api']","['semat', 'openai', 'api']","['semat', 'openai', 'api']",semat openai api
openai akan menambahkan metadata cpa ke gambar yang dibuat oleh dall-,openai akan menambahkan metadata siapa ke gambar yang dibuat oleh dall,"['openai', 'akan', 'menambahkan', 'metadata', 'siapa', 'ke', 'gambar', 'yang', 'dibuat', 'oleh', 'dall']","['openai', 'akan', 'tambah', 'metadata', 'siapa', 'ke', 'gambar', 'yang', 'buat', 'oleh', 'dall']","['openai', 'metadata', 'gambar', 'dall']",openai metadata gambar dall
ollama now has an openai-compatible api nice,ollama sekarang memiliki sebuah openai-compatible api bagus,"['ollama', 'sekarang', 'memiliki', 'sebuah', 'openai-compatible', 'api', 'bagus']","['ollama', 'sekarang', 'milik', 'buah', 'openai-compatible', 'api', 'bagus']","['milik', 'buah', 'openai-compatible', 'api', 'bagus']",milik buah openai-compatible api bagus
pembangun rabbit menunjukkan demo rabbit os diajar melakukan tugas menggunakan kamera apabila sudah dilatih ia kemudiannya melakukan tugasan yang sama semula tanpa pengawasan,pembangun rabbit menunjukkan demo rabbit os diajar melakukan tugas menggunakan kamera apabila sudah dilatih ia kemudiannya melakukan tugas yang sama semula tanpa pengawasan,"['pembangun', 'rabbit', 'menunjukkan', 'demo', 'rabbit', 'os', 'diajar', 'melakukan', 'tugas', 'menggunakan', 'kamera', 'apabila', 'sudah', 'dilatih', 'ia', 'kemudiannya', 'melakukan', 'tugas', 'yang', 'sama', 'semula', 'tanpa', 'pengawasan']","['bangun', 'rabbit', 'tunjuk', 'demo', 'rabbit', 'os', 'ajar', 'laku', 'tugas', 'guna', 'kamera', 'apabila', 'sudah', 'latih', 'ia', 'kemudian', 'laku', 'tugas', 'yang', 'sama', 'mula', 'tanpa', 'awas']","['bangun', 'rabbit', 'demo', 'rabbit', 'os', 'ajar', 'laku', 'tugas', 'kamera', 'latih', 'laku', 'tugas', 'awas']",bangun rabbit demo rabbit os ajar laku tugas kamera latih laku tugas awas
lho orang openai sendiri mengakui terkait copyright kok malah anda blg ga bisa pdhl si openai salah satu pembuat ai bilang ga mungkin sementara ada ai yang menerapkan itu apakah sulit membaca artikel dibawah ini,lho orang openai sendiri mengakui terkait copyright kok malah anda bilang tidak bisa padahal si openai salah satu pembuat kecerdasan buatan bilang tidak mungkin sementara ada kecerdasan buatan yang menerapkan itu apakah sulit membaca artikel di bawah ini,"['lho', 'orang', 'openai', 'sendiri', 'mengakui', 'terkait', 'copyright', 'kok', 'malah', 'anda', 'bilang', 'tidak', 'bisa', 'padahal', 'si', 'openai', 'salah', 'satu', 'pembuat', 'kecerdasan', 'buatan', 'bilang', 'tidak', 'mungkin', 'sementara', 'ada', 'kecerdasan', 'buatan', 'yang', 'menerapkan', 'itu', 'apakah', 'sulit', 'membaca', 'artikel', 'di', 'bawah', 'ini']","['lho', 'orang', 'openai', 'sendiri', 'aku', 'kait', 'copyright', 'kok', 'malah', 'anda', 'bilang', 'tidak', 'bisa', 'padahal', 'si', 'openai', 'salah', 'satu', 'buat', 'cerdas', 'buat', 'bilang', 'tidak', 'mungkin', 'sementara', 'ada', 'cerdas', 'buat', 'yang', 'terap', 'itu', 'apakah', 'sulit', 'baca', 'artikel', 'di', 'bawah', 'ini']","['orang', 'openai', 'kait', 'copyright', 'bilang', 'openai', 'salah', 'cerdas', 'bilang', 'cerdas', 'terap', 'sulit', 'baca', 'artikel']",orang openai kait copyright bilang openai salah cerdas bilang cerdas terap sulit baca artikel
sam altman berkata pihaknya telah menambah baik model ai gpt bagi memastikan ia memberi output dan maklum balas lebih baik berbanding sebelum ini,mas altman berkata pihaknya telah menambah baik model kecerdasan buatan gpt bagi memastikan ia memberi keluaran dan maklum balas lebih baik berbanding sebelum ini,"['mas', 'altman', 'berkata', 'pihaknya', 'telah', 'menambah', 'baik', 'model', 'kecerdasan', 'buatan', 'gpt', 'bagi', 'memastikan', 'ia', 'memberi', 'keluaran', 'dan', 'maklum', 'balas', 'lebih', 'baik', 'berbanding', 'sebelum', 'ini']","['mas', 'altman', 'kata', 'pihak', 'telah', 'tambah', 'baik', 'model', 'cerdas', 'buat', 'gpt', 'bagi', 'pasti', 'ia', 'beri', 'keluar', 'dan', 'maklum', 'balas', 'lebih', 'baik', 'banding', 'belum', 'ini']","['mas', 'altman', 'model', 'cerdas', 'gpt', 'maklum', 'balas', 'banding']",mas altman model cerdas gpt maklum balas banding
openai compatibility,openai kesesuaian,"['openai', 'kesesuaian']","['openai', 'sesuai']","['openai', 'sesuai']",openai sesuai
